{
"$schema" : "http://json-schema.org/schema#",

"title" : "Experiment schema",

"description" : "Data related to the definition of an experiment",

"type" : "object",

"properties" : 
	{
	"_id": {"type":"string"},
	"name": {"type":"string"},
	"experimenter": {"type":"string"},
	"description": {"type":"string"},
	"unit": {"type":"string"},
	"treatment" : {"type":"array", "items": {"$ref": "#/definitions/treatItem" } },
	"config" : {"type":"array", "items": {"$ref": "#/definitions/configItem" } }
	},

"definitions": {
    "treatItem": 
    	{
		"type" : "object",
		"properties" : 
			{
			"name":{"type":"string"},
			"description": {"type":"string"},
			"definition": {"type":"string"},
			"iscontrol":{"type":"boolean"}
			}
		},
	"configItem":
		{
		"type" : "object",
		"properties": 
			{
			"_id": {"type":"string"},
			"name": {"type":"string"},
			"experimenter": {"type":"string"},
			"description": {"type":"string"},
			"controller_code": {"type":"string"},
			"date_started": {"type": "array", "items":{"type":"string"}},
			"date_ended": {"type": "array", "items":{"type":"string"}},
			"run":{"enum":["ON","OFF","PAUSED"], "default":"OFF"},
			"date_to_end": {"type": "string"},
			"max_exposures": {"type": "number"},
			"test":{"type":"boolean"},
			"dist": {"type":"array", "items": {"$ref": "#/definitions/distItem" } } 
			}
		},
	"distItem": 
		{
		"type" : "object",
		"properties" : 
			{
			"segments":{"type":"number"},
			"treatment": {"type":"string"},
			"action": {"enum":["ADD","REMOVE"], "default":"add"}
			}

		}
  }
}
